{
  "engineVersion": "1.0",
  "gameType": "quiz",

  "metadata": {
    "title": "Basic Math Quiz",
    "author": "Noir12"
  },

  "settings": {
    "showScore": true,
    "shuffleQuestions": true,
    "timeLimit": 30,
    "maxScore": 100,
    "difficulty": "easy"
  },

  "content": {
    "questions": [
      {
        "id": 1,
        "question": "2 + 3 = ?",
        "options": ["4", "5", "6"],
        "answer": "5"
      },
      {
        "id": 2,
        "question": "7 × 2 = ?",
        "options": ["12", "14", "16"],
        "answer": "14"
      },
      {
        "id": 3,
        "question": "10 − 4 = ?",
        "options": ["5", "6", "7"],
        "answer": "6"
      }
    ]
  },

  "ui": {
    "theme": "light",
    "showTimer": true
  }
}
